id;text;category;left;right
dyl036;Wolisz nigdy nie używać emoji czy nigdy nie używać memów?;Dylematy;NIE UŻYWAĆ EMOJI;NIE UŻYWAĆ MEMÓW
wol001;Wolisz ciepłe dni czy chłodne wieczory?;Wolisz;CIEPŁE DNI;CHŁODNE WIECZORY
pik044;Myślisz, że ważniejsza jest długość czy technika?;Pikantne;DŁUGOŚĆ;TECHNIKA
pre056;Jak często zdarzało Ci się robić coś zakazanego, do czego nie przyznawałeś się rodzicom?;Przeszłość;RZADKO;CZĘSTO
luz016;Czy gdy coś porządkujesz, kończy się to wspominkami?;Luźne;NIGDY;ZAWSZE
pre057;Czy w szkole pomagałeś innym dzieciom w nauce?;Przeszłość;RACZEJ NIE;CZĘSTO
pik002;Czy inicjujesz zbliżenia częściej niż Twój partner?;Pikantne;NIE;TAK
swi035;Jak bardzo popierasz równe prawa dla osób LGBTQ+?;Światopoglądowe;NIE POPIERAM;POPIERAM
wol004;Wolisz rozmawiać z dużą grupą ludzi czy z jedną osobą?;Wolisz;Z GRUPĄ LUDZI;Z JEDNĄ OSOBĄ
dyl010;Wolisz mieć nieskończony dostęp do swojej ulubionej muzyki czy ulubionych filmów?;Dylematy;MUZYKA;FILMY
swi002;Czy zgadzasz się z tym, że technologia zbliża ludzi?;Światopoglądowe;NIE;TAK
pre062;Na ile pamiętasz swoje pierwsze przyjaźnie?;Przeszłość;NIE PAMIĘTAM;PAMIĘTAM DOSKONALE
pre019;Jak dobrze pamiętasz szkolne wycieczki?;Przeszłość;SŁABO;DOBRZE
wol018;Wolisz nosić jasne czy ciemne ubrania?;Wolisz;JASNE;CIEMNE
wol063;Wolisz oglądać mecze piłki nożnej czy siatkówki?;Wolisz;PIŁKA NOŻNA;SIATKÓWKA
wol064;Wolisz spędzać czas na zewnątrz czy w domu?;Wolisz;NA ZEWNĄTRZ;W DOMU
dyl024;Wolisz, żeby Twój telefon miał zawsze 10% baterii czy był zawsze wyciszony?;Dylematy;10% BATERII;WYCISZONY
dyl002;Wolisz mieć zawsze idealnie dopasowane ubrania czy zawsze modną fryzurę?;Dylematy;DOPASOWANE UBRANIA;MODNA FRYZURA
wol020;Wolisz spędzać wieczory przy grach planszowych czy oglądając filmy?;Wolisz;GRY PLANSZOWE;OGLĄDANIE FILMÓW
fun037;Czy zdarza Ci się włączyć czajnik, zapomnieć o nim i zrobić to jeszcze raz?;Śmieszne;NIGDY;CZĘSTO
wol076;Wolisz planować wszystko czy improwizować?;Wolisz;PLANOWAĆ;IMPROWIZOWAĆ
wol003;Wolisz nosić okulary czy soczewki kontaktowe?;Wolisz;OKULARY;SOCZEWKI
swi075;Jak bardzo wierzysz, że dobro wraca?;Światopoglądowe;NIE WIERZĘ;BARDZO WIERZĘ
wol057;Wolisz spędzać wakacje aktywnie czy leniuchując?;Wolisz;AKTYWNIE;LENIUCHOWANIE
pre036;Jak bardzo lubiłeś czytać książki jako dziecko?;Przeszłość;NIE LUBIŁEM;LUBIŁEM
wol039;Wolisz gotować sam czy jeść na mieście?;Wolisz;GOTOWAĆ SAM;JEŚĆ NA MIEŚCIE
wol006;Wolisz jeść śniadanie w pośpiechu czy na spokojnie?;Wolisz;W POŚPIECHU;NA SPOKOJNIE
pik022;Czy czujesz się swobodnie mówiąc „nie” nawet w intymnej sytuacji?;Pikantne;NIE;TAK
wol030;Wolisz być mistrzem jednej rzeczy czy być lekko ponad przeciętnym, ale w wielu rzeczach?;Wolisz;MISTRZ JEDNEJ RZECZY;DOBRY WE WSZYSTKIM
pre044;Na wakacje jeździłeś częściej nad morze czy w góry?;Przeszłość;NAD MORZE;W GÓRY
pre004;Jak często się śmiałeś z kolegów lub koleżanek w szkole?;Przeszłość;NIGDY;CIĄGLE
wol035;Wolisz wstawać wcześnie czy spać do późna?;Wolisz;WCZEŚNIE;PÓŹNO
pik041;Czy lubisz, gdy partner przejmuje inicjatywę?;Pikantne;NIE;TAK
pik029;Czy jesteś otwarty na wspólne odkrywanie nowych fantazji?;Pikantne;NIE;TAK
pre051;Jak dobrze pamiętasz swoje dziecięce sukcesy?;Przeszłość;NIC NIE PAMIĘTAM;PAMIĘTAM WSZYSTKO
luz031;Czy potrafisz wyjść z domu i sprawdzać trzy razy, czy masz klucze?;Luźne;RAZ WYSTARCZY;NAWET 4 RAZY
pik009;Czy przywiązanie emocjonalne wpływa na Twoją odwagę w łóżku?;Pikantne;NIE;TAK
pik011;Czy mówisz partnerowi o swoich fantazjach?;Pikantne;NIE;TAK
dyl008;Wolisz mieć dom na drzewie w lesie czy na plaży?;Dylematy;W LESIE;NA PLAŻY
wol017;Wolisz spotkania w dużym gronie czy kameralne przyjęcia?;Wolisz;DUŻE GRONO;KAMERALNIE
wol042;Wolisz słuchać muzyki pop czy rock?;Wolisz;POP;ROCK
zwi012;Czy czujesz się odpowiedzialny za atmosferę w relacji?;Związkowe;NIE;TAK
dyl050;Wolałbyś być mistrzem gier komputerowych czy sportów drużynowych?;Dylematy;GRY KOMPUTEROWE;SPORTY ZESPOŁOWE
pik014;Czy kiedykolwiek czułeś pociąg do kogoś zupełnie „niedozwolonego”?;Pikantne;NIE;TAK
wol059;Wolisz robić zdjęcia czy oglądać zdjęcia?;Wolisz;ROBIĆ;OGLĄDAĆ
swi009;Czy zgadzasz się z tym, że rozwój gospodarczy jest ważniejszy niż ochrona środowiska?;Światopoglądowe;NIE;TAK
fun059;Czy zdarza Ci się mówić do zwierząt, jak do ludzi?;Śmieszne;NIE;TAK
luz009;Jak często zdarza Ci się zapomnieć, po co wszedłeś do pokoju?;Luźne;RZADKO;CZĘSTO
luz046;Jak często gubisz się w myślach podczas najprostszych zadań?;Luźne;RZADKO;CZĘSTO
fun043;Jak często zdarza Ci się myśleć o jedzeniu już 5 minut po zjedzeniu obiadu?;Śmieszne;NIGDY;ZA KAŻDYM RAZEM
fun024;Zdarza się, że Twoje ręce nie wiedzą, co robią – np. wylewając sok na klawiaturę?;Śmieszne;NIE;CZĘSTO
pre058;Jak dobrze pamiętasz swoją pierwszą miłość z dzieciństwa?;Przeszłość;W OGÓLE;DOSKONALE
pik005;Jak często zmieniasz dynamikę w łóżku — raz jesteś aktywny, a raz pasywny?;Pikantne;NIGDY NIE ZMIENIAM;ZA KAŻDYM RAZEM
zwi029;Wierzysz w miłość od pierwszego wejrzenia?;Związkowe;NIE;TAK
luz020;Jak często próbujesz użyć siły Jedi żeby coś np. przyciągnąć do siebie?;Luźne;NIGDY;CIĄGLE
fun050;Jak często zdarza Ci się zacząć coś robić i zapomnieć, po co to robiłeś?;Śmieszne;NIGDY;CIĄGLE
fun004;Jak często zdarza ci się zapomnieć, że masz okulary na nosie i wszędzie ich szukać?;Śmieszne;NIGDY;CO CHWILĘ
luz021;Jak traktujesz quizy typu „Którą pizzą jesteś?”?;Luźne;GŁUPOTA;BARDZO POWAŻNIE
fun052;Jak często zdarza Ci się przypadkowo włączyć mikrofon w złych momentach?;Śmieszne;NIGDY;CZĘSTO
fun064;Zdarza Ci się zapomnieć, co robiłeś dosłownie kilka sekund temu?;Śmieszne;RZADKO;CZĘSTO
luz013;Jak oceniasz swój talent aktorski?;Luźne;FATALNY;ZASŁUGUJE NA OSCARA
fun019;Zdarza Ci się kliknąć „wyślij”, zanim skończysz pisać wiadomość?;Śmieszne;NIE;CZĘSTO
pre053;Jak bardzo lubiłeś chodzić na szkolne imprezy/dyskoteki?;Przeszłość;W OGÓLE;KOCHAŁEM
fun056;Czy zdarza Ci się przypadkiem zadzwonić do kogoś, klikając coś w kieszeni?;Śmieszne;NIE;CZĘSTO
pre009;Jak dobrze pamiętasz swoją pierwszą wycieczkę szkolną?;Przeszłość;SŁABO;PERFEKCYJNIE
fun006;Jak często zdarza Ci się zapomnieć, że już umyłeś zęby i zrobić to jeszcze raz?;Śmieszne;NIGDY;CODZIENNIE
zwi002;Co jest dla ciebie ważniejsze w związku - czułość czy rozmowa?;Związkowe;CZUŁOŚĆ;ROZMOWA
swi051;Jak ważne są dla Ciebie tradycje?;Światopoglądowe;NIE SĄ WAŻNE;BARDZO WAŻNE
wol011;Wolisz oglądać seriale czy filmy?;Wolisz;SERIALE;FILMY
pik034;Czy potrafisz całkowicie poddać się drugiej osobie?;Pikantne;NIE;TAK
luz037;Czy często „gubisz” rzeczy, które trzymasz w ręce?;Luźne;RZADKO;CZĘSTO
pik052;Czy ważna jest dla Ciebie estetyka w zbliżeniach?;Pikantne;NIE;TAK
luz041;Czy zdarza Ci się rozmawiać z roślinami w mieszkaniu?;Luźne;NIE;TAK
pik001;Czy Twoje życie intymne to dla Ciebie luźny temat?;Pikantne;NIE;TAK
fun055;Czy zdarza Ci się kichnąć tak mocno, że wystraszysz nawet siebie?;Śmieszne;NIE;CZĘSTO
luz008;Czy masz nawyk tworzenia playlist na każdą możliwą okazję?;Luźne;NIE;TAK
fun026;Czy zdarza Ci się śmiać z czegoś, czego nikt inny nie rozumie?;Śmieszne;NIE;TAK
pre006;Jak często zdarzało Ci się śpiewać lub tańczyć jako dziecko?;Przeszłość;RZADKO;CZĘSTO
swi028;Czy uważasz, że sztuka ma realny wpływ na zmianę społeczną?;Światopoglądowe;NIE;TAK
luz054;Czy jesteś w stanie wstać rano bez włączania 5 drzemek?;Luźne;NIE;TAK
wol062;Wolisz prowadzić samochód czy podróżować pociągiem?;Wolisz;PROWADZIĆ SAMOCHÓD;JECHAĆ POCIĄGIEM
dyl027;Wolisz być bohaterem książki czy filmu?;Dylematy;KSIĄŻKI;FILMU
wol066;Wolisz poranki czy wieczory?;Wolisz;PORANKI;WIECZORY
zwi024;Kto w twojej relacji zwykle „wygrywa” kłótnie?;Związkowe;JA;PARNER/PARTNERKA
pre059;Czy musiałeś ukrywać słodycze przed rodzicami?;Przeszłość;NIE;TAK
zwi042;Czy potrafisz rozmawiać o trudnych tematach w relacji?;Związkowe;NIE;TAK
swi017;Czy uważasz, że wolność jednostki powinna mieć swoje granice?;Światopoglądowe;NIE;TAK
luz039;Czy lubisz sprawdzać lodówkę bez zamiaru wyjmowania czegokolwiek?;Luźne;NIE;TAK
dyl034;Wolisz nigdy nie mieć kaca czy nigdy nie odczuwać zmęczenia?;Dylematy;BRAK KACA;BRAK ZMĘCZENIA
dyl052;Wolałbyś mieć zdolność rozmawiania z roślinami czy z przedmiotami?;Dylematy;Z ROŚLINAMI;Z PRZEDMIOTAMI
fun036;Jak często udajesz, że rozumiesz, o czym ktoś mówi?;Śmieszne;NIGDY;ZAWSZE
luz019;Jak robisz notatki, to później je czytasz czy o nich zapominasz?;Luźne;CZYTAM;ZAPOMINAM O NICH
pre050;Jak często jadłeś słodycze jako dziecko?;Przeszłość;BARDZO RZADKO;CZĘSTO
fun040;Czy zdarza Ci się wciskać 'drzemkę' tyle razy, że potem się wszędzie spóźniasz?;Śmieszne;NIE;TAK
fun066;Czy czasem mówisz coś głośno, a potem zastanawiasz się, czy ktoś to usłyszał?;Śmieszne;NIGDY;CZĘSTO
wol074;Wolisz świętować urodziny w domu czy na wyjeździe?;Wolisz;W DOMU;NA WYJEŹDZIE
pik026;Czy bycie zaskoczonym w sypialni sprawia Ci większą przyjemność niż planowanie?;Pikantne;NIE;TAK
dyl025;Wolisz zostać bohaterem filmu akcji czy komedii romantycznej?;Dylematy;FILM AKCJI;KOMEDIA ROMANTYCZNA
pre005;Jak często pomagałeś w domu rodzeństwu?;Przeszłość;RZADKO;CZĘSTO
pre011;Czy miałeś problemy z nauczycielami lub wychowawcą?;Przeszłość;NIE;TAK
swi065;Czy uważasz, że dzieci powinny mieć prawo decydować o swoim życiu?;Światopoglądowe;NIE;TAK
luz005;Czy zdarza Ci się zjeść coś z podłogi?;Luźne;NIE;TAK
pik038;Czy sytuacje „zakazane” bywają dla Ciebie bardziej ekscytujące?;Pikantne;NIE;TAK
luz051;Jak trudne byłoby dla ciebie przeżycie tygodnia bez internetu?;Luźne;BANALNE;NIEMOŻLIWE
dyl007;Wolisz móc rozmawiać tylko za pomocą rysunków czy tylko za pomocą muzyki?;Dylematy;RYSUNKI;MUZYKA
luz044;Jak dziwna była najdziwniejsza rzecz, którą kolekcjonowałeś?;Luźne;NORMALNA;BARDZO DZIWNA
wol060;Wolisz jeść na słodko czy na słono?;Wolisz;NA SŁODKO;NA SŁONO
swi078;Na ile uważasz, że system edukacji wymaga gruntownej reformy?;Światopoglądowe;W OGÓLE;BARDZO
dyl051;Wolałbyś przez cały dzień mówić szeptem czy krzyczeć?;Dylematy;MÓWIĆ SZEPTEM;KRZYCZEĆ
pre031;Często zdarzało Ci się być kapitanem drużyny lub grupy?;Przeszłość;NIE;TAK
luz022;Czy miałeś kiedyś wymyślonego przyjaciela?;Luźne;NIE;TAK
luz010;Czy zdarza Ci się tańczyć samemu w pokoju?;Luźne;NIE;CZĘSTO
luz047;Czy byłbyś w stanie zamieszkać w małym domku na wsi bez technologii?;Luźne;NIE;TAK
swi027;Czy wierzysz, że każdy ma wpływ na swoją przyszłość?;Światopoglądowe;NIE;TAK
wol032;Wolisz lato pełne słońca czy lekki deszcz?;Wolisz;PEŁNE SŁOŃCE;LEKKI DESZCZ
wol022;Wolisz spędzać wolny czas sam w ciszy czy z ludzi?;Wolisz;W CISZY;Z LUDŹMI
wol031;Wolisz spędzać czas w mieście czy na wsi?;Wolisz;MIASTO;WIEŚ
pik027;Czy potrafisz otwarcie mówić o swoich granicach w intymności?;Pikantne;NIE;TAK
wol065;Wolisz książkę czy film?;Wolisz;KSIĄŻKA;FILM
wol051;Wolisz zwierzęta domowe czy egzotyczne?;Wolisz;DOMOWE;EGZOTYCZNE
wol081;Wolałbyś mieć dużo energii rano czy wieczorem?;Wolisz;RANO;WIECZOREM
pik051;Co ma dla Ciebie większe znaczenie w intymności - dotyk czy słowa?;Pikantne;DOTYK;SŁOWA
wol033;Wolisz spacerować po lesie czy nad morzem?;Wolisz;PO LESIE;NAD MORZEM
wol077;Wolisz mieszkać blisko centrum miasta czy na jego obrzeżach?;Wolisz;CENTRUM;OBRZEŻA
luz002;Czy zdarza Ci się zasnąć podczas oglądania filmu, który sam wybrałeś?;Luźne;NIE;TAK
zwi050;Czy potrafisz spać spokojnie po kłótni z bliską osobą?;Związkowe;NIE;TAK
wol048;Wolisz słuchać muzyki na żywo na koncercie czy z nagrania?;Wolisz;NA ŻYWO;Z NAGRANIA
wol046;Wolisz oglądać filmy w domu czy w kinie?;Wolisz;W DOMU;W KINIE
swi050;Czy uważasz, że każdy zasługuje na szacunek – niezależnie od poglądów?;Światopoglądowe;NIE;TAK
pre063;Jak podobały Ci się Twoje pierwsze wakacje bez rodziców?;Przeszłość;BYŁY FATALNE;BYŁY SUPER
wol067;Wolisz wziąć prysznic czy kąpiel?;Wolisz;PRYSZNIC;KĄPIEL
zwi013;Czy zdarza Ci się mówić coś, czego później żałujesz?;Związkowe;NIE;TAK
wol036;Wolisz chodzić do kina na nowe premiery czy czekać na premierę w domu?;Wolisz;W KINIE;W DOMU
pre022;Jak oceniasz twoje relacje z nauczycielami?;Przeszłość;BARDZO SŁABE;BARDZO DOBRE
luz015;Co sądzisz o pracy jako tester łóżek?;Luźne;FATALNA PRACA;WYMARZONA PRACA
dyl044;Wolałbyś mieć super moc teleportacji, ale tylko w jedno miejsce, czy umieć latać, ale tylko na 1 metr?;Dylematy;TELEPORTACJA;LATANIE
pre023;Czy w dzieciństwie bałeś się ciemności?;Przeszłość;NIE BAŁEM SIĘ;BARDZO
fun031;Czy przekładasz czasem rzeczy z miejsca na miejsce bez powodu?;Śmieszne;NIGDY;CZĘSTO
fun035;Czy gdy ktoś coś tłumaczy zazwyczaj myślisz o czymś innym czy jesteś skupiony?;Śmieszne;MYŚLĘ O CZYMŚ INNYM;JESTEM SKUPIONY
fun041;Jak często zdarza Ci się rozlać napój w najbardziej nieodpowiednim momencie?;Śmieszne;RZADKO;CZĘSTO
fun046;Zdarza Ci się śpiewać nawet jeśli nie znasz tekstu piosenki?;Śmieszne;NIE;CZĘSTO
luz027;Jak często zdarza Ci się planować rzeczy, których i tak nigdy nie zrealizujesz?;Luźne;RZADKO;CZĘSTO
luz004;Czy potrafisz prowadzić logiczną rozmowę tuż po obudzeniu?;Luźne;NIE;TAK
wol079;Wolisz pikantne czy łagodne jedzenie?;Wolisz;PIKANTNE;ŁAGODNE
swi077;Jak bardzo ufasz nauce i badaniom medycznym?;Światopoglądowe;NIE UFAM;UFAM W PEŁNI
fun070;Jak często zdarza Ci się pomachać komuś, kto wcale nie machał do Ciebie?;Śmieszne;RZADKO;CZĘSTO
zwi061;Czy czujesz się swobodnie rozmawiając o przeszłości partnera?;Związkowe;NIE;TAK
luz055;Czy postrzegasz siebie jako głównego bohatera swojego życia?;Luźne;NIE;TAK
dyl053;Wolisz przez miesiąc codziennie jeść pizzę czy burgery?;Dylematy;PIZZA;BURGER
pik054;Czy uważasz, że rozmowa po zbliżeniu jest równie ważna jak samo zbliżenie?;Pikantne;NIE;TAK
wol080;Wolisz jeść fast food czy domowe posiłki?;Wolisz;FAST FOOD;DOMOWE
luz000;Jak często śpiewasz w samotności?;Luźne;NIGDY;BARDZO CZĘSTO
luz000;Jak bardzo przeszkadza Ci cisza w towarzystwie?;Luźne;WCALE;BARDZO
fun063;Czy czasami zapominasz, co chciałeś kupić zaraz po wejściu do sklepu?;Śmieszne;NIE;TAK
zwi051;Czy potrafisz zostawić partnerowi przestrzeń dla siebie?;Związkowe;NIE;TAK
pik045;Czy jesteś otwarty na próbowanie nowych rzeczy w łóżku?;Pikantne;NIE;TAK
dyl043;Wolałbyś mieć talent do gotowania czy do majsterkowania?;Dylematy;GOTOWANIE;MAJSTERKOWANIE
swi066;Czy uważasz, że każdy powinien mieć prawo do posiadania broni?;Światopoglądowe;NIE;TAK
wol070;Wolisz rozmawiać przez telefon czy pisać wiadomości?;Wolisz;ROZMOWA;WIADOMOŚCI
pik046;Czy jesteś otwarty na niestandardowe formy intymności?;Pikantne;NIE;TAK
zwi052;Czy często wyrażasz uczucia słowami?;Związkowe;RZADKO;CZĘSTO
pik047;Czy lubisz grę wstępną dłuższą niż samo zbliżenie?;Pikantne;NIE;TAK
wol071;Wolisz słuchać muzyki głośno czy cicho?;Wolisz;GŁOŚNO;CICHO
pik048;Czy lubisz budować napięcie zanim dojdzie do zbliżenia?;Pikantne;NIE;TAK
luz045;Czy zdarza Ci się zniknąć z imprezy bez pożegnania?;Luźne;NIE;TAK
pik049;Czy czujesz się pewnie nago przy drugiej osobie?;Pikantne;NIE;TAK
zwi053;Czy czujesz się swobodnie pokazując swoje słabości w związku?;Związkowe;NIE;TAK
pik050;Czy bliskość fizyczna buduje dla Ciebie więź emocjonalną?;Pikantne;NIE;TAK
swi067;Czy uważasz, że powinno się ograniczać sztuczną inteligencję w codziennym życiu?;Światopoglądowe;NIE;TAK
zwi054;Czy wspólne poczucie humoru jest dla Ciebie ważne?;Związkowe;NIE;TAK
swi068;Czy zgadzasz się z tym, że praca powinna być gwarantowana przez państwo?;Światopoglądowe;NIE;TAK
fun065;Czy zdarza Ci się tak wciągnąć w grę, że zapominasz o całym świecie?;Śmieszne;NIE;TAK
swi069;Jak bardzo cenisz sobie prawo do prywatności?;Światopoglądowe;WCALE;BARDZO
pre060;Jak często spotykałeś się z przyjaciółmi po szkole?;Przeszłość;RZADKO;CZĘSTO
swi070;Jak bardzo zgadzasz się z tym, że zwierzęta mają takie same prawa do życia jak ludzie?;Światopoglądowe;NIE ZGADZAM SIĘ;ZGADZAM SIĘ
dyl045;Wolisz mieć talent do śpiewania czy do tańca?;Dylematy;ŚPIEW;TANIEC
swi071;Jak ważne są dla Ciebie wartości rodzinne?;Światopoglądowe;NIE WAŻNE;BARDZO WAŻNE
pre061;Jak bardzo lubiłeś zajęcia plastyczne w szkole?;Przeszłość;NIE LUBIŁEM;UWIELBIAŁEM
dyl046;Wolisz jeść tylko potrawy o jednej barwie czy o jednej konsystencji?;Dylematy;BARWA;KONSYSTENCJA
swi072;Czy zgadzasz się z tym, że każda religia powinna być traktowana równo?;Światopoglądowe;NIE;TAK
dyl047;Wolisz jeść tylko jedną potrawę przez resztę życia czy nigdy nie jeść swojego ulubionego dania?;Dylematy;JEDNA POTRAWA;BEZ ULUBIONEGO
swi073;Czy uważasz, że panuje równość płci w społeczeństwie?;Światopoglądowe;NIE;TAK
wol072;Wolisz oglądać filmy z przyjaciółmi czy samotnie?;Wolisz;Z PRZYJACIÓŁMI;SAMOTNIE
fun067;Czy potrafisz zgubić się w sklepie, który znasz od lat?;Śmieszne;NIE;TAK
dyl048;Wolisz mieć zawsze idealnie posprzątany pokój czy idealnie ułożoną garderobę?;Dylematy;POKÓJ;GARDEROBA
swi074;Czy wierzysz w przeznaczenie?;Światopoglądowe;NIE;TAK
wol073;Wolisz długie rozmowy czy krótkie i treściwe?;Wolisz;DŁUGIE;KRÓTKIE
luz049;Czy zdarza Ci się intensywnie o czymś myśleć i po chwili o tym zapomnieć?;Luźne;NIE;TAK
zwi056;Czy wyrażanie wdzięczności jest dla Ciebie ważnym elementem relacji?;Związkowe;NIE;TAK
pik053;Czy czujesz się pewnie rozmawiając o seksie?;Pikantne;NIE;TAK
wol075;Wolisz weekendy pełne emocji czy leniwe dni?;Wolisz;EMOCJE;LENIWE
fun068;Czy Twoja poduszka bywa kusząca bardziej niż cały dzień obowiązków?;Śmieszne;NIE;TAK
zwi057;Czy jesteś gotów pójść na kompromis?;Związkowe;NIE;TAK
zwi058;Czy lubisz planować wspólną przyszłość?;Związkowe;NIE;TAK
zwi059;Czy drobne nawyki partnera często Cię irytują?;Związkowe;NIE;TAK
luz050;Jak dobrym detektywem byś był?;Luźne;SŁABYM;DOBRYM
dyl049;Wolałbyś codziennie budzić się w nowym mieście czy zawsze w tym samym miejscu?;Dylematy;NOWE MIASTO;JEDNO MIEJSCE
pre064;Jak często pomagałeś rodzicom w domu?;Przeszłość;RZADKO;CZĘSTO
fun069;Jak dobrze potrafisz naśladować dźwięki zwierząt?;Śmieszne;SŁABO;DOBRZE
luz052;Czy myślisz, że poradziłbyś sobie w średniowieczu?;Luźne;NIE;TAK
swi076;Czy uważasz, że jednostka może zmieniać świat?;Światopoglądowe;NIE;TAK
luz053;Czy zdarza Ci się zgubić w miejscu, które dobrze znasz?;Luźne;RZADKO;CZĘSTO
zwi060;Jak często potrzebujesz zapewnień o uczuciach?;Związkowe;RZADKO;CZĘSTO
wol078;Wolisz oglądać filmy z napisami czy z lektorem?;Wolisz;NAPISY;LEKTOR
wol055;Wolisz nosić ubrania luźne czy eleganckie?;Wolisz;LUŹNE;ELEGANCKIE
pre049;Czy często marzyłeś o byciu kimś wyjątkowym lub sławnym?;Przeszłość;NIE;TAK
fun047;Czy potrafisz udawać powagę, gdy coś jest naprawdę głupie?;Śmieszne;NIE;TAK
wol056;Wolisz chodzić wolno czy szybko?;Wolisz;WOLNO;SZYBKO
fun048;Czy zdarza Ci się powiedzieć "dzień dobry" o 22:00?;Śmieszne;NIE;TAK
fun049;Czy masz talent do gubienia kluczy?;Śmieszne;NIE;TAK
wol058;Wolisz spędzać weekend w domu czy na wycieczce?;Wolisz;W DOMU;NA WYCIECZCE
dyl035;Wolisz mieć moc zmiany koloru włosów czy oczu na życzenie?;Dylematy;WŁOSY;OCZY
fun051;Czy jesteś mistrzem przewracania się o nic?;Śmieszne;NIE;TAK
pik037;Jesteś bardziej dominujący czy uległy?;Pikantne;DOMINUJĄCY;ULEGŁY
pre052;Czy jesteś zadowolony ze swojego zachowania w dzieciństwie?;Przeszłość;NIE;TAK
zwi040;Czy potrafisz traktować różnice między Wami jako coś wartościowego?;Związkowe;NIE;TAK
fun053;Czy Twój pies lub kot patrzy czasem na Ciebie jak na dziwaka?;Śmieszne;NIE;TAK
swi052;Czy uważasz, że w szkole powinno się uczyć empatii?;Światopoglądowe;NIE;TAK
swi053;Czy młodzież powinna mieć większy wpływ na politykę?;Światopoglądowe;NIE;TAK
swi054;Czy zmiany klimatu to poważny problem?;Światopoglądowe;NIE;TAK
fun054;Czy Twój zegar biologiczny żyje własnym życiem?;Śmieszne;NIE;TAK
wol061;Wolisz owoce czy warzywa?;Wolisz;OWOCE;WARZYWA
zwi041;Czy lubisz wspólne gotowanie jako formę spędzania czasu?;Związkowe;NIE;TAK
dyl037;Wolisz mieć w kieszeni zawsze 10 groszy czy 5 cukierków?;Dylematy;10 GROSZY;5 CUKIERKÓW
swi055;Czy wierzysz, że ludzie są z natury dobrzy?;Światopoglądowe;NIE;TAK
luz038;Czy często śpiewasz w samochodzie?;Luźne;NIGDY;ZAWSZE
fun057;Czy Twoje reakcje przypominają memy?;Śmieszne;NIE;TAK
pik039;Czy gra w dominację i uległość Cię intryguje?;Pikantne;NIE;TAK
dyl038;Wolisz mieć głos jak kaczka czy chodzić jak pingwin?;Dylematy;GŁOS KACZKI;CHÓD PINGWINA
pre054;Czy w dzieciństwie marzyłeś, żeby być już dorosłym?;Przeszłość;NIE;TAK
zwi043;Czy szczerość powinna być absolutna – nawet jeśli rani?;Związkowe;NIE;TAK
zwi044;Czy poczucie humoru w związku jest dla Ciebie ważne?;Związkowe;NIE;TAK
dyl039;Wolisz umieć czytać książki w sekundę czy uczyć się języka w godzinę?;Dylematy;CZYTANIE;JĘZYKI
dyl040;Wolisz mieć nieskończoną baterię w telefonie czy darmowy internet wszędzie?;Dylematy;BATERIA;INTERNET
swi056;Czy każdy powinien mieć dostęp do opieki zdrowotnej bez względu na zarobki?;Światopoglądowe;NIE;TAK
dyl041;Wolałbyś żyć w świecie bez kolorów czy bez dźwięków?;Dylematy;BEZ KOLORÓW;BEZ DŹWIĘKÓW
dyl042;Wolałbyś jeździć rowerem po wodzie czy latać na nim?;Dylematy;PO WODZIE;LATAĆ
fun058;Czy zdarza Ci się mówić do siebie i udawać, że ktoś odpowiada?;Śmieszne;NIE;TAK
swi057;Czy demokracja wymaga aktywnego udziału obywateli?;Światopoglądowe;NIE;TAK
swi058;Czy kara śmierci powinna być dopuszczalna?;Światopoglądowe;NIE;TAK
pik040;Kto częściej zaczyna flirt – Ty czy druga osoba?;Pikantne;JA;ONA/ON
swi059;Czy myślisz, że przyszłość będzie lepsza niż teraźniejszość?;Światopoglądowe;NIE;TAK
pre055;Czy pamiętasz swoje dziecięce marzenia?;Przeszłość;NIE;TAK
luz040;Czy mówisz czasem "zaraz wracam" i wracasz za godzinę?;Luźne;NIE;TAK
swi060;Czy nauka powinna dominować nad wiarą?;Światopoglądowe;NIE;TAK
zwi045;Czy starasz się unikać niepotrzebnych spięć w związku?;Związkowe;NIE;TAK
swi061;Czy społeczeństwo jest zbyt uzależnione od technologii?;Światopoglądowe;NIE;TAK
swi062;Czy praca powinna dawać przede wszystkim satysfakcję, a nie pieniądze?;Światopoglądowe;NIE;TAK
fun060;Czy Twoje sny bywają tak dziwne, że boisz się o swój mózg?;Śmieszne;NIE;TAK
swi063;Czy państwo powinno mieć większy wpływ na wychowanie dzieci?;Światopoglądowe;NIE;TAK
fun061;Czy zdarza Ci się napisać wiadomość i zapomnieć ją wysłać?;Śmieszne;NIE;TAK
wol068;Wolisz kawę czy herbatę?;Wolisz;KAWA;HERBATA
pik042;Czy flirtowanie w miejscu publicznym daje Ci dreszczyk emocji?;Pikantne;NIE;TAK
zwi046;Czy w relacji powinno się mówić wszystko?;Związkowe;NIE;TAK
pik043;Czy Twoja wyobraźnia erotyczna zaskakuje nawet Ciebie?;Pikantne;NIE;TAK
zwi047;Czy bywasz niepewny swoich uczuć w dłuższej relacji?;Związkowe;NIE;TAK
zwi048;Czy jesteś typem romantyka?;Związkowe;NIE;TAK
fun062;Czy masz taki bałagan w telefonie, że szukasz aplikacji godzinami?;Śmieszne;NIE;TAK
wol069;Wolisz ubierać się kolorowo czy stonowanie?;Wolisz;KOLOROWO;STONOWANIE
zwi049;Czy czujesz się słuchany w związku?;Związkowe;NIE;TAK
swi064;Czy wierzysz w życie po śmierci?;Światopoglądowe;NIE;TAK
luz042;Czy chciałbyś mieszkać w domku na drzewie?;Luźne;NIE;TAK
luz043;Czy czasem udajesz, że kogoś nie widzisz, żeby z nim nie rozmawiać?;Luźne;NIE;TAK
dyl023;Wolisz jeść tylko słodkie przez tydzień czy tylko słone?;Dylematy;SŁODKIE;SŁONE
swi038;Czy zgadzasz się z ideą, że każdy człowiek ma prawo do szczęścia?;Światopoglądowe;NIE;TAK
luz025;Czy często nadajesz imiona przedmiotom w swoim domu?;Luźne;NIE;TAK
fun033;Czy Twój śmiech rozśmiesza innych bardziej niż żart?;Śmieszne;NIE;TAK
luz026;Czy kiedyś uczyłeś się czegoś tylko po to, żeby zaimponować komuś?;Luźne;NIE;TAK
pre038;Czy brałeś udział w klubach sportowych lub zajęciach dodatkowych?;Przeszłość;NIE;TAK
pik030;Czy potrafisz wyczytać intencje z ciała drugiej osoby?;Pikantne;NIE;TAK
dyl026;Wolisz zawsze zapominać twarze znajomych czy ich imiona?;Dylematy;TWARZE;IMIONA
fun034;Czy potrafisz wyobrazić sobie życie bez kawy?;Śmieszne;NIE;TAK
swi039;Na ile zgadzasz się z zasadą „oko za oko”?;Światopoglądowe;WCALE;W PEŁNI
zwi028;Czy lubisz dzielić się codziennymi szczegółami ze swoim partnerem?;Związkowe;NIE;TAK
wol040;Wolisz wakacje w górach czy nad jeziorem?;Wolisz;GÓRY;JEZIORO
wol041;Wolisz lato czy zimę?;Wolisz;LATO;ZIMA
swi040;Czy uważasz, że media społecznościowe mają pozytywny wpływ na ludzi?;Światopoglądowe;NIE;TAK
pre039;Jak bardzo lubiłeś zajęcia pozalekcyjne?;Przeszłość;NIE LUBIŁEM;LUBIŁEM
swi041;Czy uważasz, że ludzie powinni mieć prawo do eutanazji?;Światopoglądowe;NIE;TAK
luz028;Czy potrafisz wytrzymać cały dzień bez narzekania?;Luźne;NIE;TAK
pre040;Jak często zdarzało Ci się odrabiać lekcje na ostatnią chwilę?;Przeszłość;NIGDY;ZAWSZE
pre041;Czy byłeś osobą, która łatwo nawiązywała nowe znajomości?;Przeszłość;NIE;TAK
swi042;Czy uważasz, że rozwój cywilizacji szkodzi naturze?;Światopoglądowe;NIE;TAK
luz029;Czy Twoje sny czasem mają więcej sensu niż rzeczywistość?;Luźne;NIE;TAK
pik031;Czy lubisz eksperymentować z miejscem i czasem zbliżenia?;Pikantne;NIE;TAK
